{
  "format": "bgwq.configuration",
  "format_version": 1,
  "definition": {
    "key": "international-draughts",
    "name": "International Draughts",
    "min_participants": 2,
    "max_participants": 2,
    "semantics_version": 1
  },
  "roles": [
    {
      "key": "seat_0",
      "name": "Player 1",
      "min": 1,
      "max": 1,
      "forward_row": 1
    },
    {
      "key": "seat_1",
      "name": "Player 2",
      "min": 1,
      "max": 1,
      "forward_row": -1
    }
  ],
  "phases": [
    {
      "key": "turn",
      "name": "Turn",
      "initial": true,
      "order": 0
    }
  ],
  "entities": [
    {
      "key": "game",
      "kind": "game",
      "name": "Game"
    },
    {
      "key": "board",
      "kind": "space",
      "name": "Board"
    },
    {
      "key": "square",
      "kind": "space",
      "name": "Square"
    },
    {
      "key": "man",
      "kind": "item",
      "name": "Man"
    },
    {
      "key": "king",
      "kind": "item",
      "name": "King"
    },
    {
      "key": "victory",
      "kind": "objective",
      "name": "Victory"
    },
    {
      "key": "draw",
      "kind": "objective",
      "name": "Draw"
    },
    {
      "key": "capture_quest",
      "kind": "objective",
      "name": "Capture Quest"
    }
  ],
  "seeds": [
    {
      "key": "root",
      "type": "game"
    },
    {
      "key": "board",
      "type": "board",
      "parent": "root"
    },
    {
      "key": "s0_1",
      "type": "square",
      "parent": "board",
      "row": 0,
      "column": 1,
      "x": 100,
      "y": 900
    },
    {
      "key": "s0_3",
      "type": "square",
      "parent": "board",
      "row": 0,
      "column": 3,
      "x": 300,
      "y": 900
    },
    {
      "key": "s0_5",
      "type": "square",
      "parent": "board",
      "row": 0,
      "column": 5,
      "x": 500,
      "y": 900
    },
    {
      "key": "s0_7",
      "type": "square",
      "parent": "board",
      "row": 0,
      "column": 7,
      "x": 700,
      "y": 900
    },
    {
      "key": "s0_9",
      "type": "square",
      "parent": "board",
      "row": 0,
      "column": 9,
      "x": 900,
      "y": 900
    },
    {
      "key": "s1_0",
      "type": "square",
      "parent": "board",
      "row": 1,
      "column": 0,
      "x": 0,
      "y": 800
    },
    {
      "key": "s1_2",
      "type": "square",
      "parent": "board",
      "row": 1,
      "column": 2,
      "x": 200,
      "y": 800
    },
    {
      "key": "s1_4",
      "type": "square",
      "parent": "board",
      "row": 1,
      "column": 4,
      "x": 400,
      "y": 800
    },
    {
      "key": "s1_6",
      "type": "square",
      "parent": "board",
      "row": 1,
      "column": 6,
      "x": 600,
      "y": 800
    },
    {
      "key": "s1_8",
      "type": "square",
      "parent": "board",
      "row": 1,
      "column": 8,
      "x": 800,
      "y": 800
    },
    {
      "key": "s2_1",
      "type": "square",
      "parent": "board",
      "row": 2,
      "column": 1,
      "x": 100,
      "y": 700
    },
    {
      "key": "s2_3",
      "type": "square",
      "parent": "board",
      "row": 2,
      "column": 3,
      "x": 300,
      "y": 700
    },
    {
      "key": "s2_5",
      "type": "square",
      "parent": "board",
      "row": 2,
      "column": 5,
      "x": 500,
      "y": 700
    },
    {
      "key": "s2_7",
      "type": "square",
      "parent": "board",
      "row": 2,
      "column": 7,
      "x": 700,
      "y": 700
    },
    {
      "key": "s2_9",
      "type": "square",
      "parent": "board",
      "row": 2,
      "column": 9,
      "x": 900,
      "y": 700
    },
    {
      "key": "s3_0",
      "type": "square",
      "parent": "board",
      "row": 3,
      "column": 0,
      "x": 0,
      "y": 600
    },
    {
      "key": "s3_2",
      "type": "square",
      "parent": "board",
      "row": 3,
      "column": 2,
      "x": 200,
      "y": 600
    },
    {
      "key": "s3_4",
      "type": "square",
      "parent": "board",
      "row": 3,
      "column": 4,
      "x": 400,
      "y": 600
    },
    {
      "key": "s3_6",
      "type": "square",
      "parent": "board",
      "row": 3,
      "column": 6,
      "x": 600,
      "y": 600
    },
    {
      "key": "s3_8",
      "type": "square",
      "parent": "board",
      "row": 3,
      "column": 8,
      "x": 800,
      "y": 600
    },
    {
      "key": "s4_1",
      "type": "square",
      "parent": "board",
      "row": 4,
      "column": 1,
      "x": 100,
      "y": 500
    },
    {
      "key": "s4_3",
      "type": "square",
      "parent": "board",
      "row": 4,
      "column": 3,
      "x": 300,
      "y": 500
    },
    {
      "key": "s4_5",
      "type": "square",
      "parent": "board",
      "row": 4,
      "column": 5,
      "x": 500,
      "y": 500
    },
    {
      "key": "s4_7",
      "type": "square",
      "parent": "board",
      "row": 4,
      "column": 7,
      "x": 700,
      "y": 500
    },
    {
      "key": "s4_9",
      "type": "square",
      "parent": "board",
      "row": 4,
      "column": 9,
      "x": 900,
      "y": 500
    },
    {
      "key": "s5_0",
      "type": "square",
      "parent": "board",
      "row": 5,
      "column": 0,
      "x": 0,
      "y": 400
    },
    {
      "key": "s5_2",
      "type": "square",
      "parent": "board",
      "row": 5,
      "column": 2,
      "x": 200,
      "y": 400
    },
    {
      "key": "s5_4",
      "type": "square",
      "parent": "board",
      "row": 5,
      "column": 4,
      "x": 400,
      "y": 400
    },
    {
      "key": "s5_6",
      "type": "square",
      "parent": "board",
      "row": 5,
      "column": 6,
      "x": 600,
      "y": 400
    },
    {
      "key": "s5_8",
      "type": "square",
      "parent": "board",
      "row": 5,
      "column": 8,
      "x": 800,
      "y": 400
    },
    {
      "key": "s6_1",
      "type": "square",
      "parent": "board",
      "row": 6,
      "column": 1,
      "x": 100,
      "y": 300
    },
    {
      "key": "s6_3",
      "type": "square",
      "parent": "board",
      "row": 6,
      "column": 3,
      "x": 300,
      "y": 300
    },
    {
      "key": "s6_5",
      "type": "square",
      "parent": "board",
      "row": 6,
      "column": 5,
      "x": 500,
      "y": 300
    },
    {
      "key": "s6_7",
      "type": "square",
      "parent": "board",
      "row": 6,
      "column": 7,
      "x": 700,
      "y": 300
    },
    {
      "key": "s6_9",
      "type": "square",
      "parent": "board",
      "row": 6,
      "column": 9,
      "x": 900,
      "y": 300
    },
    {
      "key": "s7_0",
      "type": "square",
      "parent": "board",
      "row": 7,
      "column": 0,
      "x": 0,
      "y": 200
    },
    {
      "key": "s7_2",
      "type": "square",
      "parent": "board",
      "row": 7,
      "column": 2,
      "x": 200,
      "y": 200
    },
    {
      "key": "s7_4",
      "type": "square",
      "parent": "board",
      "row": 7,
      "column": 4,
      "x": 400,
      "y": 200
    },
    {
      "key": "s7_6",
      "type": "square",
      "parent": "board",
      "row": 7,
      "column": 6,
      "x": 600,
      "y": 200
    },
    {
      "key": "s7_8",
      "type": "square",
      "parent": "board",
      "row": 7,
      "column": 8,
      "x": 800,
      "y": 200
    },
    {
      "key": "s8_1",
      "type": "square",
      "parent": "board",
      "row": 8,
      "column": 1,
      "x": 100,
      "y": 100
    },
    {
      "key": "s8_3",
      "type": "square",
      "parent": "board",
      "row": 8,
      "column": 3,
      "x": 300,
      "y": 100
    },
    {
      "key": "s8_5",
      "type": "square",
      "parent": "board",
      "row": 8,
      "column": 5,
      "x": 500,
      "y": 100
    },
    {
      "key": "s8_7",
      "type": "square",
      "parent": "board",
      "row": 8,
      "column": 7,
      "x": 700,
      "y": 100
    },
    {
      "key": "s8_9",
      "type": "square",
      "parent": "board",
      "row": 8,
      "column": 9,
      "x": 900,
      "y": 100
    },
    {
      "key": "s9_0",
      "type": "square",
      "parent": "board",
      "row": 9,
      "column": 0,
      "x": 0,
      "y": 0
    },
    {
      "key": "s9_2",
      "type": "square",
      "parent": "board",
      "row": 9,
      "column": 2,
      "x": 200,
      "y": 0
    },
    {
      "key": "s9_4",
      "type": "square",
      "parent": "board",
      "row": 9,
      "column": 4,
      "x": 400,
      "y": 0
    },
    {
      "key": "s9_6",
      "type": "square",
      "parent": "board",
      "row": 9,
      "column": 6,
      "x": 600,
      "y": 0
    },
    {
      "key": "s9_8",
      "type": "square",
      "parent": "board",
      "row": 9,
      "column": 8,
      "x": 800,
      "y": 0
    },
    {
      "key": "man_0_0_1",
      "type": "man",
      "owner": 0,
      "location": "s0_1",
      "values": {
        "moved": false
      }
    },
    {
      "key": "man_0_0_3",
      "type": "man",
      "owner": 0,
      "location": "s0_3",
      "values": {
        "moved": false
      }
    },
    {
      "key": "man_0_0_5",
      "type": "man",
      "owner": 0,
      "location": "s0_5",
      "values": {
        "moved": false
      }
    },
    {
      "key": "man_0_0_7",
      "type": "man",
      "owner": 0,
      "location": "s0_7",
      "values": {
        "moved": false
      }
    },
    {
      "key": "man_0_0_9",
      "type": "man",
      "owner": 0,
      "location": "s0_9",
      "values": {
        "moved": false
      }
    },
    {
      "key": "man_0_1_0",
      "type": "man",
      "owner": 0,
      "location": "s1_0",
      "values": {
        "moved": false
      }
    },
    {
      "key": "man_0_1_2",
      "type": "man",
      "owner": 0,
      "location": "s1_2",
      "values": {
        "moved": false
      }
    },
    {
      "key": "man_0_1_4",
      "type": "man",